{
  "versao_schema": 1,
  "projeto": {
    "id": "PEM-D16",
    "nome": "Maestro · PEM-D16 (Risco cognitivo)"
  },
  "vocabulario": "copiloto-executar",
  "wip_limite": 1,
  "atualizado_em": "2026-09-29T10:53:16.821Z",
  "nos": [
    {
      "id": "E0",
      "trilha": "S",
      "tipo": "estagio",
      "titulo": "Verificação e inventário (inclui F7-delta)",
      "lane": null,
      "skill": null,
      "skill_version": null,
      "playbook": "skills/estagios-bpm/references/E0.md",
      "status": "BLOCKED",
      "motivo_bloqueio": {
        "codigo": "USER_ACTION_REQUIRED",
        "detalhe": "Rodar E0 na máquina local (scripts/e2e.sh + skill_fingerprint das cópias enviadas × instaladas, rc-cognitive-risk-expert), dar acesso ao EXECUTAR_SKILLS_REGISTRY e responder D6 (mangemnet), D7 (DRP), D8 (workbook)"
      },
      "dono_canonico": "repo",
      "depends_on": [],
      "dod": "Todo item de §2–§9 de mapa/divergencias-e-lacunas.md tem status (CONFIRMADO/REFUTADO/NÃO ENCONTRADO) e fonte; nenhum CONFIRMADO sem evidência de comando ou URL primária.",
      "efeito_externo": false,
      "autorizacao": null,
      "escopo_escrita": [],
      "output": [
        "07-execucao/E0-verificacao.md",
        "07-execucao/evidencias/E0/"
      ],
      "evidencias": [
        {
          "id": "EVD-E0-1",
          "caminho": "07-execucao/E0-verificacao.md",
          "criterio": "todos os itens §2–§9 com status e fonte, no ambiente cloud",
          "classe": "A_OBSERVADO",
          "registrada_em": "2026-09-28T12:42:23.576Z",
          "ator": "maestro"
        },
        {
          "id": "EVD-E0-2",
          "caminho": "07-execucao/evidencias/E0/prova-C.jsonl",
          "criterio": "subagente de plugin ignora hooks do frontmatter (confirmado)",
          "classe": "A_OBSERVADO",
          "registrada_em": "2026-09-28T12:42:23.579Z",
          "ator": "maestro"
        }
      ],
      "gaps": [],
      "conflitos": [],
      "decisao": null,
      "refs": [],
      "historico": [
        {
          "em": "2026-09-28T12:02:21.421Z",
          "de": null,
          "para": "BACKLOG_VALIDATED",
          "motivo": "seed a partir de ING-0002 (07-execucao/ESTADO.md do pacote)",
          "ator": "maestro"
        },
        {
          "em": "2026-09-28T12:02:21.441Z",
          "de": "BACKLOG_VALIDATED",
          "para": "READY",
          "motivo": "sem dependências abertas",
          "ator": "maestro"
        },
        {
          "em": "2026-09-28T12:42:23.564Z",
          "de": "READY",
          "para": "DOING",
          "motivo": "E0 no contêiner cloud",
          "ator": "maestro"
        },
        {
          "em": "2026-09-28T12:42:23.569Z",
          "de": "DOING",
          "para": "DOING",
          "motivo": "atualização [output]: verificação cloud registrada",
          "ator": "maestro"
        },
        {
          "em": "2026-09-28T12:42:23.572Z",
          "de": "DOING",
          "para": "VERIFY",
          "motivo": "artefato E0 (cloud) salvo",
          "ator": "maestro"
        },
        {
          "em": "2026-09-28T12:42:23.584Z",
          "de": "VERIFY",
          "para": "BLOCKED",
          "motivo": "fechamento exige o ambiente local do usuário",
          "ator": "maestro"
        }
      ],
      "atualizado_em": "2026-09-28T12:42:23.584Z"
    },
    {
      "id": "E1",
      "trilha": "S",
      "tipo": "estagio",
      "titulo": "Descoberta e definição (Charter, SIPOC, Ficha 22 pontos)",
      "lane": null,
      "skill": null,
      "skill_version": null,
      "playbook": "skills/estagios-bpm/references/E1.md",
      "status": "BACKLOG_VALIDATED",
      "motivo_bloqueio": null,
      "dono_canonico": "repo",
      "depends_on": [
        "E0"
      ],
      "dod": "Charter tem objetivo/escopo/início-fim/cliente; SIPOC tem 5 colunas; Ficha soma 22 e cada ponto preenchido tem fonte.",
      "efeito_externo": false,
      "autorizacao": null,
      "escopo_escrita": [],
      "output": [],
      "evidencias": [],
      "gaps": [],
      "conflitos": [],
      "decisao": null,
      "refs": [],
      "historico": [
        {
          "em": "2026-09-28T12:02:21.430Z",
          "de": null,
          "para": "BACKLOG_VALIDATED",
          "motivo": "seed a partir de ING-0002 (07-execucao/ESTADO.md do pacote)",
          "ator": "maestro"
        }
      ],
      "atualizado_em": "2026-09-28T12:02:21.430Z"
    },
    {
      "id": "E2",
      "trilha": "S",
      "tipo": "estagio",
      "titulo": "Desenho e modelagem (topologia, roteamento, ADRs, D1–D11)",
      "lane": null,
      "skill": null,
      "skill_version": null,
      "playbook": "skills/estagios-bpm/references/E2.md",
      "status": "BACKLOG_VALIDATED",
      "motivo_bloqueio": null,
      "dono_canonico": "repo",
      "depends_on": [
        "E1"
      ],
      "dod": "Toda linha de mapa/roteamento.json tem skill vencedora ou lacuna declarada; nenhuma decisão D# fica implícita.",
      "efeito_externo": false,
      "autorizacao": null,
      "escopo_escrita": [],
      "output": [],
      "evidencias": [],
      "gaps": [],
      "conflitos": [],
      "decisao": null,
      "refs": [],
      "historico": [
        {
          "em": "2026-09-28T12:02:21.430Z",
          "de": null,
          "para": "BACKLOG_VALIDATED",
          "motivo": "seed a partir de ING-0002 (07-execucao/ESTADO.md do pacote)",
          "ator": "maestro"
        }
      ],
      "atualizado_em": "2026-09-28T12:02:21.430Z"
    },
    {
      "id": "E3",
      "trilha": "S",
      "tipo": "estagio",
      "titulo": "Análise de riscos (FMEA)",
      "lane": null,
      "skill": null,
      "skill_version": null,
      "playbook": "skills/estagios-bpm/references/E3.md",
      "status": "BACKLOG_VALIDATED",
      "motivo_bloqueio": null,
      "dono_canonico": "repo",
      "depends_on": [
        "E2"
      ],
      "dod": "Cada risco top-N tem controle, dono (ou A DEFINIR) e eval; os 8 riscos obrigatórios de agente estão presentes.",
      "efeito_externo": false,
      "autorizacao": null,
      "escopo_escrita": [],
      "output": [],
      "evidencias": [],
      "gaps": [],
      "conflitos": [],
      "decisao": null,
      "refs": [],
      "historico": [
        {
          "em": "2026-09-28T12:02:21.431Z",
          "de": null,
          "para": "BACKLOG_VALIDATED",
          "motivo": "seed a partir de ING-0002 (07-execucao/ESTADO.md do pacote)",
          "ator": "maestro"
        }
      ],
      "atualizado_em": "2026-09-28T12:02:21.431Z"
    },
    {
      "id": "E4",
      "trilha": "S",
      "tipo": "estagio",
      "titulo": "Agent Spec, Tool/Permission Matrix e Eval Suite",
      "lane": null,
      "skill": null,
      "skill_version": null,
      "playbook": "skills/estagios-bpm/references/E4.md",
      "status": "BACKLOG_VALIDATED",
      "motivo_bloqueio": null,
      "dono_canonico": "repo",
      "depends_on": [
        "E3"
      ],
      "dod": "Nenhum agente sai de DRAFT sem eval P0/P1 vinculado; toda ferramenta de escrita externa tem aprovação definida.",
      "efeito_externo": false,
      "autorizacao": null,
      "escopo_escrita": [],
      "output": [
        "07-execucao/E4-agent-specs/",
        "07-execucao/E4-tool-permission-matrix.md",
        "07-execucao/E4-eval-suite.md",
        "evals/"
      ],
      "evidencias": [],
      "gaps": [],
      "conflitos": [],
      "decisao": null,
      "refs": [
        "CC-002"
      ],
      "historico": [
        {
          "em": "2026-09-28T12:02:21.431Z",
          "de": null,
          "para": "BACKLOG_VALIDATED",
          "motivo": "seed a partir de ING-0002 (07-execucao/ESTADO.md do pacote)",
          "ator": "maestro"
        },
        {
          "em": "2026-09-28T12:40:26.104Z",
          "de": "BACKLOG_VALIDATED",
          "para": "BACKLOG_VALIDATED",
          "motivo": "atualização [output, refs]: artefatos antecipados na v0.1.0 (CC-002) — re-verificar em E4",
          "ator": "maestro"
        }
      ],
      "atualizado_em": "2026-09-28T12:40:26.104Z"
    },
    {
      "id": "E5",
      "trilha": "S",
      "tipo": "estagio",
      "titulo": "Walking skeleton",
      "lane": null,
      "skill": null,
      "skill_version": null,
      "playbook": "skills/estagios-bpm/references/E5.md",
      "status": "BACKLOG_VALIDATED",
      "motivo_bloqueio": null,
      "dono_canonico": "repo",
      "depends_on": [
        "E4"
      ],
      "dod": "npm run check verde; EV-001/002/003 falham do jeito certo (bloqueiam); relatório Overkill preenchido.",
      "efeito_externo": false,
      "autorizacao": null,
      "escopo_escrita": [],
      "output": [
        "07-execucao/E5-relatorio.md"
      ],
      "evidencias": [],
      "gaps": [],
      "conflitos": [],
      "decisao": null,
      "refs": [
        "CC-002"
      ],
      "historico": [
        {
          "em": "2026-09-28T12:02:21.431Z",
          "de": null,
          "para": "BACKLOG_VALIDATED",
          "motivo": "seed a partir de ING-0002 (07-execucao/ESTADO.md do pacote)",
          "ator": "maestro"
        },
        {
          "em": "2026-09-28T12:40:26.106Z",
          "de": "BACKLOG_VALIDATED",
          "para": "BACKLOG_VALIDATED",
          "motivo": "atualização [output, refs]: relatório antecipado na v0.1.0 (CC-002) — re-verificar em E5",
          "ator": "maestro"
        }
      ],
      "atualizado_em": "2026-09-28T12:40:26.106Z"
    },
    {
      "id": "E6",
      "trilha": "S",
      "tipo": "estagio",
      "titulo": "Teste e validação (gate para a Trilha L)",
      "lane": null,
      "skill": null,
      "skill_version": null,
      "playbook": "skills/estagios-bpm/references/E6.md",
      "status": "BACKLOG_VALIDATED",
      "motivo_bloqueio": null,
      "dono_canonico": "repo",
      "depends_on": [
        "E5"
      ],